{
  "manifest_id": "configuration_finish_framed_terminal_test",
  "case_id": "configuration_finish_framed_terminal",
  "contract_path": "oracle/contracts/775/configuration_finish_framed_terminal.contract.json",
  "answer_path": "oracle/answers/775/configuration_finish_framed_terminal.answer.jsonl",
  "rust_test_target": "oracle/rust-tests/tests/oracle_contracts.rs",
  "rust_test_name": "configuration_finish_framed_terminal_matches_official_oracle_answer",
  "comparison_surface": "decoded_fields",
  "comparison_surface_note": "Compares official Configuration finish_configuration framed packet ids and empty bodies by splitting generated frames and dispatching the official body bytes through Stevenarella packet_by_id in both directions; terminal flags are read from the generated official answer artifact.",
  "test_topology_note": "The target file and test name are this manifest's current adapter, not the universal runner topology for all oracle cases.",
  "official_source": {
    "jar_role": "client",
    "jar_path": "_analysis/minecraft-26.1.2/client.jar",
    "function_or_member": "ConfigurationProtocols.SERVERBOUND.codec().encode/decode(ServerboundFinishConfigurationPacket.INSTANCE), ConfigurationProtocols.CLIENTBOUND.codec().encode/decode(ClientboundFinishConfigurationPacket.INSTANCE), ServerboundFinishConfigurationPacket.INSTANCE.isTerminal(), ClientboundFinishConfigurationPacket.INSTANCE.isTerminal()",
    "decompiled_source_path": "_analysis/minecraft-26.1.2/decompiled-protocol/net/minecraft/network/protocol/configuration/ConfigurationProtocols.java"
  },
  "internal_owner": {
    "domain": "wire_protocol",
    "path": "stevenarella/protocol/src/protocol/mod.rs",
    "symbol_or_test_surface": "packet::packet_by_id(775, State::Configuration, Direction::{Serverbound, Clientbound}, official packet id, official body)",
    "scope_note": "Current implementation witness for Configuration finish_configuration framed dispatch/decode; terminal flags are official-answer evidence only until Stevenarella has an explicit terminal-packet API."
  },
  "corridor": "Login -> Configuration -> Play",
  "traceability_path": "docs/analysis/protocol/versions/775/traceability.md",
  "stop_boundary": "This manifest proves Configuration finish_configuration packet framing, dispatch/decode, and terminal flags only; it does not prove runtime Configuration-to-Play readiness."
}
